,staff_review,review_topic
135,"I am hugely unimpressed by the additional charge by BA when all the work is by me and on-line and BA can re-sell my Friday flight; the time I spent going around in circles, online, to end up with nothing and having to phone Customer Services; and  the time it takes to get though to Customer Services who, clearly, are insufficiently staffed, over-worked and with limited capacity to really help.",Staff Problems
136,I saw an elderly Chinese couple struggle with the computers and a uniformed staff member in BA uniform walked away and ignored them. No cash was accepted and the staff were very embarrassed.,Staff Problems
138,"I was close to the galley and sleep was pretty much impossible due, in part, to the cabin crew gossiping loudly about other members of staff.",Staff Problems
139,"They have in the past left me stranded in Moscow for 5 days when snow closed Heathrow, yet BMI were still flying into Heathrow, I have encountered rude staff on check in, long queues even for Executive members.",Staff Problems
141,"No one took charge of our situation, information filtered through Italian speaking passengers who sought help with staff from Iberia airlines. BA staff was gone after 6pm and we were shuttled to hotel and told a rep would give us further information at hotel.",Staff Problems
142,And Qatar Airways ground service staff show that they do care.,Staff Problems
143,"The staff could not have cared less and spent the time chatting about how low BA had sunk, how staff morale was terrible and how they could escape!",Staff Problems
144,It's hard to raise a smile from many of the check in staff/stewards - they don't seem to care anymore.,Staff Problems
145,"Unsurprisingly, boarding in Stuttgart by agency staff was chaotic - unsure who was entitled to what.",Staff Problems
146,"Terrible service all round, the airline has gone down and staff really don't care - especially in heathrow baggage office.",Staff Problems
147,The staff were not even nice about it.,Staff Problems
148,After pleading with airport staff we were placed on a flight to Bahrain and transferred to our original planned destination New Delhi.,Staff Problems
149,"When I got the BA self service machine with 55 minutes remaining in the original flight timing (and almost 2+ hours before the actual flight time) I had issues printing my boarding pass and was told by the helper to go to Zone E to get a Boarding pass printed by the counter staff, after waiting 20 minutes in the queue (bearing in mind that the flight was delayed by an hour and so there was still over 1.5 hours remaining until flight take off) I was told that the flight has been closed and as I was not there an hour before the flight time they can not help me and I ca not fly on that flight so I will have to take the next one (from 8am flight I was moved to 11am flight).",Staff Problems
150,"Even with boarding pass pre-arranged, there is no Bag drop in Montreal, just one long line, British Airways BA staff.",Staff Problems
151,"The staff are surly and abrupt, the seating cramped and uncomfortable.",Staff Problems
152,"The staff tried in vain to change the ticket but were told by faceless managers, ""no nothing could be done"".",Staff Problems
153,Upon takeoff the aircon above decided it was going to start leaking water above - when the guy sat in seat enquired the staff smiled said she would see what she can do then went to the galley behind me and I heard her say to a co-worker that's the last of her problems.,Staff Problems
154,On the return journey I noticed part of the reason for this new policy: the Stuttgart ground staff have now been replaced by agency staff.,Staff Problems
155,Arrived early at airport to find plane was overbooked so my partner and I didn't get our seats together - ground staff could do nothing about it.,Staff Problems
156,I have never been spoken to so rudely by a member of staff in my life!,Staff Problems
157,"I informed the cabin staff of this - but due to the flight being overbooked, I couldn't be moved and so I was given an extra pillow. When I complained about this to the flight staff on the second occasion (keep in mind this was at the end of the flight when I had been sitting on an uncomfortable metal bar for 10 hours) - the steward informed me that 'I was travelling to a poor country and I should be grateful for the food I was getting'. I do not book flights with BA to get lectured by your flight staff.",Staff Problems
158,I checked a bag so just had a small carry on but the staff insisted it have this silly thing attached that I immediately ripped off.,Staff Problems
159,"The BA staff at the airport weren't helpful at all, they were all very rude and none of them could give us any reasonable information as to where my luggage was.",Staff Problems
160,Poor communications from LHR British Airways staff.,Staff Problems
161,British Airways were completely under staffed and disorganised. Staff are old and 'entitled'.,Staff Problems
162,"To make things worse, the ground staff proceed to suggest that its my fault because I booked two separate tickets, which I know for a fact that I didn't because I booked a round-the-world flight. Staff have attitude across the board.",Staff Problems
163,Cabin staff stomp up and down the aisle attending to premium economy - bumped into numerous times.,Staff Problems
164,"The cabin staff would rather have other passengers disturbed by aggravated, tired, hungry children.",Staff Problems
166,They ground staff explained they had cancelled my ticket as they thought I would not make it.,Staff Problems
167,On this particular flight staff seemed unfriendly and unapproachable and there seemed to be a general contempt for economy travellers.,Staff Problems
168,When I asked the BA staff and managers to arrange access they only gave me an insulting £5 worth of voucher.,Staff Problems
169,"From disruption in the cabin the like of which I have never witnessed on any airline other than British Airways, to delays on nearly all BA flights I have taken in 2016, rude, surly staff that act like BA was still a 1970's state enterprise.",Staff Problems
170,My return flight to Bangkok on a tired sunken seat with bent worn and distorted table closures and scratched video screen topped by the sight of BA cabin staff too short and rotund to be able to reach and close the overhead lockers before take off - and persuading a bemused passenger out his seat to do this for them that this is not the former 'flag carrier' but a worn out and low cost discount carrier.,Staff Problems
171,"The seat was very uncomfortable, slow service from section cabin staff and  in my opinion just too many people are accommodated on this aircraft.",Staff Problems
172,"Very grumpy and abrupt staff and the meal, if you can call it that, was a sandwich and a small coffee in a paper cup.",Staff Problems
173,This is apparently a new policy and the staff member said it has led to many complaints from customers.,Staff Problems
174,"The cabin staff seemed hell bent on racing through ""meal"" service to maximise time available to chat in the galley.",Staff Problems
175,"Whilst some of the cabin staff are lovely, many are extremely unhelpful.",Staff Problems
176,"I could clearly hear the staff annoyingly saying ""I have called them and they are not listening so I am not doing it anymore"".",Staff Problems
177,"The staff in the plane more less accabtable. I asked the staff, and at least they found my hand luggage. Recommendation to BA, staff behaved partly unacceptable.",Staff Problems
178,"British Airways staff were no where to be found! Arriving at Heathrow, two hours to clear customs because they were short staffed.",Staff Problems
179,"Ground staff were the now usual bunch of jobs worths, refusing to change my seat because ""that's what the computer has allocated"". Cabin staff were rude and uncaring.",Staff Problems
180,"When we departed the plane it look like a rubbish tip, no waste had been collected during the flight, the cabin staff were surly and uninterested. Cabin staff were very good.",Staff Problems
181,I called BA and was messed around by their staff member. I joined a queue and was outraged when one of the check-in staff allowed a woman with 3 kids to queue jump.,Staff Problems
182,"Whilst I would agree that the staff on AA see passengers as a necessary evil (particularly as we were the lowest of the low in standard economy), the amount of room in their seat is by far a better option than those on the aging BA B747 aircraft.",Staff Problems
183,I went to a check-in bag drop counter where the staff ignored me for a good few minutes as she conducted a personal conversation with one of her colleagues. To be fair the DPD staff were helpful and told me the reference number from Swissport was wrong.,Staff Problems
184,"I've had occasional problems - rude staff, freezing planes, poor service - but generally been satisfied.",Staff Problems
185,Service was variable - the VOD in my seat did not work (all I could get was the map) and one of the staff reset it (quite grudgingly I felt) 3 times without success. Thankfully a more senior staff member was able to find the only other unoccupied seat about 3 hours after takeoff.,Staff Problems
187,Check-in staff rude and arrogant and didn't explain the delay.,Staff Problems
188,Other people were turned back rather rudely by BA staff.,Staff Problems
189,"The staff on our return flight were rude to passengers and nice only to a select few. I definitely got the impression that you are either a have or a have not with this airline, and if you're a have not then don't even bother expecting any courtesies from the staff. The people sitting next to me had a complaint and it took 3 hours for a staff member to address them. The staff only made one announcement, and must not have had their speaker turned on because it was barely audible.",Staff Problems
192,"So why no extra staff to cope with this? Unbelievably, desk staffed by only one person.",Staff Problems
193,"When we touched down in Bombay the flight attendants said that BA ground staff would help us with missed flights, connections etc, and we should speak with them when we disembarked. On this advice we sought out uniformed BA ground staff in the luggage hall and asked for advice on what to do. Armed with this advice from BA staff we went ahead and purchased new tickets. I can only conclude that the BA staff member we spoke with in Bombay was either fobbing us off or was improperly instructed in what to say to customers. Either way British Airways should be held responsible for the advice their staff give.",Staff Problems
194,Passengers were arguing with one another (3 separate fights were witnessed) and staff were being very aggressive shoving bags and coats in every nook and cranny and telling people to move.,Staff Problems
195,"The staff at Paris airport refused to check-in my piece of luggage on the continuing Avianca flight because I had not booked that ticket with BA. When I pointed out to the BA staff the impact this would have they said it was my fault for booking 2 separate tickets, and Avianca are not part of oneworld like BA, but in Star Alliance.",Staff Problems
196,"when I arrived at Heathrow, I was told by a member of staff that my name was not on the system. The flight attendant told me not to worry and there will be lots of BA ground staff to help us all when we arrive at Johannesburg. Once landed there were no British Airways staff present - except for one lady in a High Vis jacket who explained to people that needed to get the connecting flight to Johannesburg to leave their luggage as it would be put on the plane and to Run to the next gate for the flight. No staff were helpful even though I was crying and feeling completely bewildered.",Staff Problems
197,"45 minutes later when trying to board flight, we were stopped and told we were now at the back of the plane with our tickets given to BA staff, who were sitting comfortably.",Staff Problems
198,"The major downside - as I write this in the middle of my trip - is the ground staff at Heathrow. I know that with United, they may not offer club access for free, but you can at least buy it and I have found their ground staff at Heathrow far superior to the UK's flagship carrier - unfortunately.",Staff Problems
199,"The staff were loud and abrupt, providing the bare minimum service and yelling across the cabin at each other making the whole journey even more unpleasant.",Staff Problems
200,We had a long wait at a deserted Genoa airport and no British Airways or other staff were on hand to assist or offer drink or food.,Staff Problems
201,The staff was very friendly. Looking after our area was a charming staff who really made us feel welcome and did his very best to find some people seconds if they were left hungry after the meal.,Staff Problems
202,"It did not help that the British Airways staff blatantly allowed people to cut in line, for no reason. The counter staff, and how they were managed, was completely inadequate.",Staff Problems
203,"A problem with seat I had booked and paid extra for, ground staff said they had no authority - lots of phone calls nothing achieved, suggested I spoke with crew, understanding but pretty lack luster.",Staff Problems
204,"The check-in person said they would try and get us two seats together when we presented at the gate, but as usual when you present at the bag-drop the staff member will say whatever is necessary to get you away and through security with minimum fuss and delay.",Staff Problems
205,"Lost luggage office at Amsterdam was difficult to find, but staff were helpful.",Staff Problems
206,"Worst experience I've ever had in an airport, poor organisation with bad customer service from British Airways staff who didn't care that I would have a 5 hour delay, due to been told I would need to cancel and rebook my conecting internal flight. No staff seemed to care about the delay my partner and I were experiencing after a 7 hour flight.",Staff Problems
207,"The flight to NYC was on a Boeing 747 which really did need an uplift, the seats and decor was tired and the staff rude. The staff were better than the previous flight.",Staff Problems
208,Our plane was really old and most staff were almost the same.,Staff Problems
209,"Upon checking in to return was met with rude staff who commented ""don't even touch that it's hassle just refer her to ticketing"" where I spent the next two hours waiting for them to check me in. However this wasn't all - check in staff went on to tell me that my 32 kilo case could not be boarded as it was too heavy under health and safety regulations. Would never fly British Airways again due to the complete and utter incompetence of the ground staff at Miami.",Staff Problems
210,Flight was delayed by more than 2 hours but ground staff were unfriendly and unwilling to help arrange transport options even though plane touched down after midnight with no public transport options available.,Staff Problems
212,"The staff were friendly and food was good, selection of films was more than satisfactory. I was appalled to see that there was no back up at all in the first place, but then we were told our baggage would be with us within two days by one of British Airways staff. The staff have been unhelpful and unwilling to aid us in finding our luggage, which has spoiled our holiday completely and left us in a dofficult situation with 4 children under 12.",Staff Problems
213,We informed the ground staff.,Staff Problems
214,"Phoning the call centre resulted in being told the check-in staff could assist. Arriving at Heathrow the check in staff informed us there was nothing they could do but ask at the gate. The staff at the gate told us they could do nothing and had already told another family they would not be seated together. The only person who offered any form of assistance was a wonderful staff member at Changi airport on the transfer desk when we stopped, who managed to seat me across the aisle from my husband from the Singapore-Sydney leg. Not one British Airways staff member apologised for this. A request for alternative food was ignored repeatedly and staff were outright rude to passengers who asked for a landing card towards the end of the flight (I was told to go get it myself at the back of the plane).",Staff Problems
215,"The seat that I had booked 24 hours in advance (a window seat) had been changed without my consent to the middle of the cabin, I complained to the staff at the gate and they said there was nothing they could do about it as the flight was full.",Staff Problems
216,"The staff were great, food was pretty good, their seating policy is a sham.",Staff Problems
217,"Service onboard the flight was perfunctory at best, and staff seem to perform to a script - in some cases portray the feeling that because they wear a BA uniform they think they are so excellent - a sad fact is their standards are below several major European airlines. The Purser, CSD (or whichever grand title they give to cabin staff) on outbound flight spent a lot of time giggling in the galley like a 6 year old child, and then proceeded to make the PA announcements in the campest and most disrespectful tone of voice - again, this seemed to be done for the amusement of his fellow t-d's.",Staff Problems
218,"Having encouraged passengers to check-in online and save it staff time and money, what does BA do? It reduces the number of staff for bag drop to the barest minimum.",Staff Problems
219,"Their idea of an Asian vegetarian meal is grilled vegetables and rice, drinks only served when the staff were either not sleeping or chatting away.",Staff Problems
220,Check in at Tegel was a disaster and ludicrously (for it has a lot of BA flights) I was told there are no BA staff at that airport to sort out problems.,Staff Problems
